"Rank","NameCountry/Region","No. of FTE Students","No. of students per staff","International Students","Female:Male Ratio"
"1","University of OxfordUnited KingdomCoursesEnquireAdmissions Support","19,718","10.9","35%","46 : 54"
"2","California Institute of TechnologyUnited StatesCoursesEnquireAdmissions Support","2,181","6.7","27%","31 : 69"
"3","Stanford UniversityUnited StatesCoursesExplore","15,658","7.7","22%","42 : 58"
"4","University of CambridgeUnited KingdomCoursesEnquireAdmissions Support","18,605","11.3","35%","45 : 55"
"5","Massachusetts Institute of TechnologyUnited StatesCoursesEnquireAdmissions Support","11,192","8.8","33%","37 : 63"
"6","Harvard UniversityUnited StatesCoursesEnquireAdmissions Support","19,890","8.8","25%","n/a"
"7","Princeton UniversityUnited StatesCoursesEnquireAdmissions Support","7,925","8.4","23%","45 : 55"
"8","Imperial College LondonUnited KingdomCoursesEnquireAdmissions Support","15,236","11.3","52%","37 : 63"
"9","ETH ZurichSwitzerlandCourses","18,616","14.9","37%","31 : 69"
"=10","University of California, BerkeleyUnited StatesCoursesEnquireAdmissions Support","34,834","12.0","16%","52 : 48"
"=10","The University of ChicagoUnited StatesCoursesExplore","13,486","6.2","24%","42 : 58"
"12","Yale UniversityUnited StatesCoursesEnquireAdmissions Support","11,946","4.4","21%","49 : 51"
"13","University of PennsylvaniaUnited StatesCoursesEnquireAdmissions Support","20,367","6.5","20%","51 : 49"
"14","University of California, Los AngelesUnited StatesCoursesEnquireAdmissions Support","38,392","9.9","16%","53 : 47"
"15","UCLUnited KingdomCoursesEnquireAdmissions Support","28,602","10.6","47%","56 : 44"
"16","Columbia UniversityUnited StatesCoursesEnquireAdmissions Support","25,659","6.0","30%","n/a"
"17","Johns Hopkins UniversityUnited StatesCoursesEnquireAdmissions Support","15,303","3.5","24%","51 : 49"
"18","Duke UniversityUnited StatesCoursesEnquireAdmissions Support","15,204","4.8","17%","49 : 51"
"19","Cornell UniversityUnited StatesCoursesEnquireAdmissions Support","21,593","9.9","19%","49 : 51"
"20","Northwestern UniversityUnited StatesCoursesEnquireAdmissions Support","18,570","14.0","16%","48 : 52"
"21","University of Michigan-Ann ArborUnited StatesCoursesEnquireAdmissions Support","41,912","8.8","16%","48 : 52"
"22","University of TorontoCanadaCoursesEnquireExplore","68,093","18.8","16%","n/a"
"23","Carnegie Mellon UniversityUnited StatesCoursesEnquireAdmissions Support","12,311","13.2","38%","38 : 62"
"24","National University of SingaporeSingaporeCoursesExplore","31,111","16.7","32%","50 : 50"
"=25","London School of Economics and Political ScienceUnited KingdomCoursesEnquireAdmissions Support","9,401","11.8","70%","53 : 47"
"=25","University of WashingtonUnited StatesCoursesEnquireAdmissions Support","45,162","11.9","15%","53 : 47"
"27","University of EdinburghUnited KingdomCoursesEnquireAdmissions Support","25,279","12.6","37%","59 : 41"
"28","Karolinska InstituteSwedenCoursesVerify Documents","7,723","11.3","23%","69 : 31"
"29","Peking UniversityChinaCoursesExplore","42,977","8.8","15%","48 : 52"
"=30","LMU MunichGermanyCoursesExplore","36,180","15.7","14%","61 : 39"
"=30","École Polytechnique Fédérale de LausanneSwitzerlandCourses","9,750","11.2","54%","27 : 73"
"32","New York UniversityUnited StatesCoursesEnquireAdmissions Support","43,021","6.6","25%","55 : 45"
"=33","Georgia Institute of TechnologyUnited StatesCoursesEnquireAdmissions Support","19,847","19.8","26%","31 : 69"
"=33","University of MelbourneAustraliaCoursesEnquire","42,273","24.8","37%","55 : 45"
"35","Tsinghua UniversityChinaCoursesExplore","41,537","14.1","10%","32 : 68"
"=36","University of British ColumbiaCanadaCoursesEnquire","51,889","18.2","29%","54 : 46"
"=36","University of Illinois at Urbana-ChampaignUnited StatesCoursesEnquireAdmissions Support","43,202","18.3","22%","46 : 54"
"=36","King’s College LondonUnited KingdomCoursesAdmissions Support","21,986","11.3","38%","61 : 39"
"39","The University of TokyoJapanCourses","26,080","7.0","10%","n/a"
"40","KU LeuvenBelgiumCoursesExplore","46,381","41.9","16%","49 : 51"
"41","University of California, San DiegoUnited StatesCoursesEnquireAdmissions Support","28,416","6.6","14%","47 : 53"
"42","McGill UniversityCanadaCoursesEnquire","30,911","13.5","24%","57 : 43"
"=43","Heidelberg UniversityGermanyCourses","29,527","24.9","17%","55 : 45"
"=43","University of Hong KongHong KongCoursesExplore","20,095","17.8","39%","51 : 49"
"45","University of Wisconsin-MadisonUnited StatesCoursesEnquireAdmissions Support","40,048","11.0","12%","51 : 49"
"46","Technical University of MunichGermanyCoursesVerify Documents","36,929","51.9","22%","33 : 67"
"47","Australian National UniversityAustraliaCoursesEnquire","15,402","19.9","35%","52 : 48"
"48","University of California, Santa BarbaraUnited StatesCoursesEnquireAdmissions Support","22,267","27.4","12%","51 : 49"
"49","The Hong Kong University of Science and TechnologyHong KongCoursesExplore","11,960","27.3","38%","n/a"
"50","University of Texas at AustinUnited StatesCoursesEnquireAdmissions Support","48,689","17.2","10%","51 : 49"
"=51","Brown UniversityUnited StatesCoursesEnquireAdmissions Support","8,694","10.2","20%","n/a"
"=51","University of California, DavisUnited StatesCoursesEnquireAdmissions Support","36,060","13.7","15%","55 : 45"
"53","University of MinnesotaUnited StatesCoursesEnquire","46,625","17.5","13%","52 : 48"
"54","Nanyang Technological University, SingaporeSingaporeCoursesExplore","25,278","16.1","32%","49 : 51"
"55","University of ManchesterUnited KingdomCoursesEnquireExplore","34,015","14.4","36%","52 : 48"
"56","University of North Carolina at Chapel HillUnited StatesCoursesEnquireAdmissions Support","26,412","7.5","8%","57 : 43"
"=57","Humboldt University of BerlinGermanyCourses","31,043","54.8","17%","n/a"
"=57","Washington University in St LouisUnited StatesCoursesExplore","12,528","5.7","17%","n/a"
"59","Delft University of TechnologyNetherlandsCoursesVerify Documents","16,174","18.9","25%","27 : 73"
"=60","The University of QueenslandAustraliaCoursesExplore","38,892","35.4","25%","55 : 45"
"=60","University of Southern CaliforniaUnited StatesCoursesEnquireAdmissions Support","38,466","13.6","23%","52 : 48"
"=60","University of SydneyAustraliaCourses","42,678","19.0","29%","57 : 43"
"63","University of AmsterdamNetherlandsCoursesExplore","25,344","14.3","10%","58 : 42"
"64","Boston UniversityUnited StatesCoursesEnquireAdmissions Support","24,714","8.4","19%","59 : 41"
"65","Wageningen University & ResearchNetherlandsCourses","9,535","15.6","23%","56 : 44"
"66","École Normale SupérieureFranceCourses","1,548","9.6","18%","40 : 60"
"67","University of Maryland, College ParkUnited StatesCoursesEnquire","31,353","16.8","9%","48 : 52"
"68","Penn State (Main campus)United StatesCoursesEnquire","45,359","12.3","13%","46 : 54"
"69","Erasmus University RotterdamNetherlandsCoursesExplore","21,854","20.6","19%","49 : 51"
"70","Purdue University West LafayetteUnited StatesCoursesEnquireAdmissions Support","38,788","17.7","22%","42 : 58"
"71","University of BristolUnited KingdomCoursesAdmissions Support","18,544","13.6","25%","52 : 48"
"=72","Ohio State University (Main campus)United StatesCoursesEnquire","52,497","12.8","12%","49 : 51"
"=72","Seoul National UniversitySouth KoreaCourses","26,777","13.1","11%","n/a"
"74","Monash UniversityAustraliaCoursesEnquire","44,217","34.5","25%","57 : 43"
"75","Free University of BerlinGermanyCoursesVerify Documents","32,909","53.9","21%","58 : 42"
"76","Chinese University of Hong KongHong KongCoursesExplore","18,433","10.5","27%","n/a"
"77","Leiden UniversityNetherlandsCoursesExplore","23,597","17.8","11%","59 : 41"
"=78","UNSW SydneyAustraliaCoursesExplore","39,121","26.3","32%","46 : 54"
"=78","RWTH Aachen UniversityGermanyCourses","42,298","54.9","17%","32 : 68"
"=80","University of GroningenNetherlandsCoursesExplore","25,281","24.4","13%","52 : 48"
"=80","University of Pittsburgh-Pittsburgh campusUnited StatesCoursesEnquireAdmissions Support","26,501","5.9","10%","51 : 49"
"=82","Dartmouth CollegeUnited StatesCoursesEnquireAdmissions Support","6,109","6.7","15%","47 : 53"
"=82","Emory UniversityUnited StatesCoursesEnquireAdmissions Support","12,649","4.4","19%","57 : 43"
"=82","Technical University of BerlinGermanyCourses","20,548","60.3","19%","34 : 66"
"=82","University of WarwickUnited KingdomCoursesEnquireAdmissions Support","18,558","14.6","38%","47 : 53"
"86","Utrecht UniversityNetherlandsCoursesExplore","31,142","15.6","7%","59 : 41"
"87","Rice UniversityUnited StatesCoursesEnquireAdmissions Support","6,447","9.0","27%","43 : 57"
"88","University of GlasgowUnited KingdomCoursesExplore","22,856","15.3","32%","57 : 43"
"=89","Korea Advanced Institute of Science and Technology (KAIST)South KoreaCourses","9,327","9.5","9%","20 : 80"
"=89","University of TübingenGermanyCoursesVerify Documents","28,074","37.3","11%","58 : 42"
"=91","University of HelsinkiFinlandCourses","23,369","17.0","6%","65 : 35"
"=91","Kyoto UniversityJapanCourses","22,547","5.5","7%","n/a"
"93","Uppsala UniversitySwedenCoursesVerify Documents","25,275","16.6","12%","57 : 43"
"94","Maastricht UniversityNetherlandsCoursesExplore","16,030","18.3","47%","58 : 42"
"95","University of FreiburgGermanyCourses","25,890","33.7","16%","52 : 48"
"=96","Durham UniversityUnited KingdomCoursesEnquireAdmissions Support","15,705","15.3","26%","54 : 46"
"=96","Lund UniversitySwedenCoursesVerify Documents","28,852","12.0","15%","53 : 47"
"=98","Aarhus UniversityDenmarkCourses","24,633","13.9","14%","55 : 45"
"=98","University of BaselSwitzerlandCourses","12,560","17.4","24%","54 : 46"
"=98","University of California, IrvineUnited StatesCoursesEnquireAdmissions Support","29,304","17.2","18%","53 : 47"
"101","Michigan State UniversityUnited StatesCoursesEnquire","45,297","15.8","16%","51 : 49"
"102","University of MannheimGermanyCoursesVerify Documents","10,808","84.0","14%","55 : 45"
"103","University of MontrealCanadaCoursesExplore","37,651","20.2","24%","58 : 42"
"=104","Georgetown UniversityUnited StatesCoursesEnquireAdmissions Support","15,726","8.6","15%","54 : 46"
"=104","Pohang University of Science and Technology (POSTECH)South KoreaCourses","3,017","10.0","4%","22 : 78"
"106","University of ZurichSwitzerlandCourses","26,042","6.1","18%","57 : 43"
"107","University of AlbertaCanadaCoursesEnquire","33,159","21.1","24%","55 : 45"
"108","Vanderbilt UniversityUnited StatesCoursesEnquireAdmissions Support","12,161","3.1","9%","52 : 48"
"109","University of SheffieldUnited KingdomCoursesEnquire","23,961","15.3","33%","50 : 50"
"=110","University of BernSwitzerlandCourses","14,651","23.3","14%","55 : 45"
"=110","University of St AndrewsUnited KingdomCoursesEnquireAdmissions Support","8,453","12.2","46%","57 : 43"
"112","University of GöttingenGermanyCoursesVerify Documents","26,549","26.1","12%","50 : 50"
"=113","University of BonnGermanyCoursesVerify Documents","33,939","73.3","13%","55 : 45"
"=113","McMaster UniversityCanadaCoursesExplore","23,943","20.4","16%","52 : 48"
"=113","Queen Mary University of LondonUnited KingdomCourses","14,502","13.2","42%","52 : 48"
"=116","University of Colorado BoulderUnited StatesCoursesEnquire","29,741","16.3","9%","44 : 56"
"=116","École PolytechniqueFranceCoursesExplore","2,669","5.0","31%","18 : 82"
"118","Ghent UniversityBelgiumCoursesVerify Documents","35,374","37.0","9%","53 : 47"
"119","City University of Hong KongHong KongCoursesExplore","9,871","11.6","30%","52 : 48"
"120","University of CopenhagenDenmarkCourses","29,796","4.2","17%","62 : 38"
"=121","Pierre and Marie Curie UniversityFranceCourses","28,473","8.0","17%","48 : 52"
"=121","Radboud University NijmegenNetherlandsCoursesExplore","19,079","19.1","11%","57 : 43"
"=121","University of SouthamptonUnited KingdomCoursesEnquire","21,049","12.8","31%","53 : 47"
"=121","University of Virginia (Main campus)United StatesCoursesEnquireAdmissions Support","23,797","10.0","12%","53 : 47"
"125","The University of Western AustraliaAustraliaCoursesEnquire","20,777","23.0","27%","50 : 50"
"=126","Case Western Reserve UniversityUnited StatesCoursesEnquireAdmissions Support","9,622","6.6","18%","48 : 52"
"=126","University of ExeterUnited KingdomCoursesExplore","18,233","17.5","27%","55 : 45"
"128","Université Catholique de LouvainBelgiumCoursesVerify Documents","23,916","38.1","19%","54 : 46"
"129","University of YorkUnited KingdomCoursesEnquire","14,676","15.3","26%","55 : 45"
"130","University of BirminghamUnited KingdomCoursesEnquire","26,362","16.7","25%","54 : 46"
"131","Arizona State University (Tempe)United StatesCoursesExplore","43,082","20.1","16%","44 : 56"
"=131","Trinity College DublinIrelandCoursesExplore","15,805","23.4","25%","58 : 42"
"132","University of OsloNorwayCoursesVerify Documents","27,215","18.7","18%","54 : 46"
"133","University of LeedsUnited KingdomCoursesEnquire","27,791","15.0","22%","59 : 41"
"134","University of FloridaUnited StatesCoursesEnquireAdmissions Support","44,911","17.0","9%","54 : 46"
"=135","Tufts UniversityUnited StatesCoursesEnquireAdmissions Support","10,462","10.1","15%","54 : 46"
"=135","Ulm UniversityGermanyCoursesVerify Documents","10,370","27.3","12%","47 : 53"
"=137","University of GenevaSwitzerlandCourses","15,587","15.0","40%","61 : 39"
"=137","Lancaster UniversityUnited KingdomCoursesEnquireAdmissions Support","11,673","13.6","35%","52 : 48"
"=137","Scuola Normale Superiore di PisaItalyCourses","545","15.1","6%","30 : 70"
"=137","Sungkyunkwan University (SKKU)South KoreaCoursesExplore","24,791","19.1","10%","n/a"
"141","Rutgers, the State University of New JerseyUnited StatesCoursesEnquireAdmissions Support","42,892","10.8","8%","52 : 48"
"142","University of AdelaideAustraliaCoursesExplore","20,462","29.6","27%","47 : 53"
"143","University of Notre DameUnited StatesCoursesEnquireAdmissions Support","11,821","13.5","10%","45 : 55"
"=144","Karlsruhe Institute of TechnologyGermanyCoursesVerify Documents","25,948","24.5","17%","27 : 73"
"=144","Stockholm UniversitySwedenCourses","31,272","23.5","8%","62 : 38"
"146","University of California, Santa CruzUnited StatesCoursesEnquire","17,203","24.5","2%","53 : 47"
"147","University of NottinghamUnited KingdomCoursesEnquire","29,738","14.7","28%","53 : 47"
"148","University of Cape TownSouth AfricaCoursesExplore","20,061","11.6","17%","53 : 47"
"149","University of SussexUnited KingdomCoursesEnquire","12,293","15.8","35%","55 : 45"
"150","Indiana UniversityUnited StatesCoursesEnquire","66,057","14.2","14%","52 : 48"
"=151","University of LausanneSwitzerlandCourses","12,647","13.5","24%","n/a"
"=151","University of RochesterUnited StatesCoursesEnquireAdmissions Support","9,628","4.5","28%","51 : 49"
"=153","University of Science and Technology of ChinaChinaCoursesExplore","14,827","8.1","3%","n/a"
"=153","University of TwenteNetherlandsCoursesVerify Documents","6,583","12.5","28%","36 : 64"
"155","Fudan UniversityChinaCourses","32,449","12.1","11%","50 : 50"
"=156","University of ArizonaUnited StatesCoursesEnquire","37,023","12.8","9%","52 : 48"
"=156","Vrije Universiteit AmsterdamNetherlandsCoursesVerify Documents","24,592","15.5","7%","56 : 44"
"158","University of LiverpoolUnited KingdomCoursesEnquire","19,085","11.7","34%","53 : 47"
"159","KTH Royal Institute of TechnologySwedenCoursesVerify Documents","12,841","15.9","17%","31 : 69"
"160","University of Erlangen-NurembergGermanyCourses","37,882","55.4","9%","49 : 51"
"=161","University of MünsterGermanyCoursesVerify Documents","41,807","42.4","6%","53 : 47"
"=161","University of ViennaAustriaCourses","34,711","20.3","26%","67 : 33"
"163","Autonomous University of BarcelonaSpainCoursesExplore","31,095","12.4","11%","59 : 41"
"164","TU DresdenGermanyCoursesVerify Documents","35,468","36.3","12%","42 : 58"
"=165","University of AucklandNew ZealandCoursesExplore","30,287","18.9","29%","54 : 46"
"=165","University of California, RiversideUnited StatesCoursesEnquire","20,901","22.6","13%","51 : 49"
"=165","University of East AngliaUnited KingdomCoursesExplore","13,997","13.9","28%","58 : 42"
"=165","University of MassachusettsUnited StatesCoursesEnquire","58,624","13.1","13%","49 : 51"
"169","Texas A&M UniversityUnited StatesCoursesExplore","53,694","22.1","9%","47 : 53"
"=170","University of CologneGermanyCoursesVerify Documents","44,882","41.3","11%","61 : 39"
"=170","University of GothenburgSwedenCoursesVerify Documents","17,761","10.6","12%","n/a"
"172","University of LeicesterUnited KingdomCoursesEnquire","14,179","12.5","36%","53 : 47"
"=173","Royal Holloway, University of LondonUnited KingdomCoursesEnquire","8,551","15.3","38%","58 : 42"
"=173","University of WaterlooCanadaCoursesExplore","31,776","24.8","15%","45 : 55"
"175","Pompeu Fabra UniversitySpainCoursesVerify Documents","10,791","20.1","12%","59 : 41"
"176","Technical University of DenmarkDenmarkCoursesVerify Documents","8,063","5.7","18%","27 : 73"
"177","Eindhoven University of TechnologyNetherlandsCoursesExplore","10,015","19.4","14%","22 : 78"
"178","University of LuxembourgLuxembourgCourses","5,219","17.2","55%","51 : 49"
"179","Paris-Sud UniversityFranceCourses","26,642","14.1","17%","55 : 45"
"=180","University of DundeeUnited KingdomCoursesEnquire","11,266","14.7","24%","61 : 39"
"=180","University of HamburgGermanyCoursesExplore","37,501","46.7","11%","57 : 43"
"=182","Cardiff UniversityUnited KingdomCoursesEnquire","23,549","14.3","25%","56 : 44"
"=182","University of MiamiUnited StatesCoursesEnquireAdmissions Support","16,054","6.0","15%","51 : 49"
"=182","Northeastern UniversityUnited StatesCoursesEnquireAdmissions Support","18,368","14.5","28%","50 : 50"
"=182","University of the WitwatersrandSouth AfricaCoursesExplore","24,565","24.5","8%","56 : 44"
"=186","Hebrew University of JerusalemIsraelCourses","17,709","10.8","5%","57 : 43"
"=186","University of WürzburgGermanyCourses","22,297","33.5","8%","57 : 43"
"=188","University of AberdeenUnited KingdomCoursesEnquire","11,554","13.6","32%","55 : 45"
"=188","Lomonosov Moscow State UniversityRussian FederationCourses","29,563","7.4","21%","45 : 55"
"=190","Newcastle UniversityUnited KingdomCoursesEnquireExplore","20,307","15.6","28%","49 : 51"
"=190","Sant’Anna School of Advanced Studies – PisaItalyCourses","679","13.1","13%","38 : 62"
"=192","Hong Kong Polytechnic UniversityHong KongCoursesExplore","21,907","25.6","25%","54 : 46"
"=192","University of ReadingUnited KingdomCoursesEnquire","12,086","13.9","29%","56 : 44"
"194","University of KonstanzGermanyCourses","11,335","50.4","12%","54 : 46"
"=195","University of CalgaryCanadaCoursesEnquire","28,047","16.0","18%","53 : 47"
"=195","National Taiwan University (NTU)TaiwanCoursesExplore","31,581","11.6","8%","40 : 60"
"197","University of Duisburg-EssenGermanyCoursesExplore","41,002","53.0","12%","49 : 51"
"=198","Brandeis UniversityUnited StatesCoursesEnquireAdmissions Support","5,532","13.1","23%","55 : 45"
"=198","Tilburg UniversityNetherlandsCoursesExplore","7,454","22.4","13%","49 : 51"
"200","University of Illinois at ChicagoUnited StatesCoursesEnquire","24,459","11.6","18%","53 : 47"
"201-250","Aalborg UniversityDenmarkCoursesExplore","19,286","17.4","15%","48 : 52"
"201-250","Aalto UniversityFinlandCourses","12,653","20.1","20%","34 : 66"
"201-250","University of AntwerpBelgiumCoursesVerify Documents","16,445","35.8","15%","54 : 46"
"201-250","University of BarcelonaSpainCoursesExplore","47,569","12.5","10%","61 : 39"
"201-250","University of BergenNorwayCourses","11,949","11.5","13%","59 : 41"
"201-250","Birkbeck, University of LondonUnited KingdomCoursesEnquire","9,690","19.5","38%","54 : 46"
"201-250","University of BolognaItalyCoursesExplore","84,486","22.3","7%","56 : 44"
"201-250","Boston CollegeUnited StatesCoursesEnquireAdmissions Support","12,932","16.5","19%","55 : 45"
"201-250","CentraleSupélecFranceCourses","4,130","11.4","32%","22 : 78"
"201-250","University of Cincinnati – UptownUnited StatesCoursesEnquire","27,712","21.9","8%","52 : 48"
"201-250","University College DublinIrelandCourses","21,438","22.7","25%","n/a"
"201-250","University of DelawareUnited StatesCoursesEnquire","19,426","16.2","10%","56 : 44"
"201-250","ESPCI ParisTechFranceCourses","481","6.3","14%","38 : 62"
"201-250","Florida State UniversityUnited StatesCoursesEnquire","41,737","30.2","7%","55 : 45"
"201-250","George Washington UniversityUnited StatesCoursesEnquire","21,409","12.4","15%","57 : 43"
"201-250","Goethe University FrankfurtGermanyCourses","45,453","13.1","15%","58 : 42"
"201-250","University of Hawai’i at MānoaUnited StatesCoursesEnquire","16,580","10.9","13%","56 : 44"
"201-250","University of IcelandIcelandCourses","13,373","24.0","8%","66 : 34"
"201-250","Indian Institute of ScienceIndiaCourses","3,398","8.3","1%","20 : 80"
"201-250","University of IowaUnited StatesCoursesEnquire","27,807","11.6","12%","52 : 48"
"201-250","University of KielGermanyCoursesVerify Documents","24,701","23.3","8%","54 : 46"
"201-250","King Abdulaziz UniversitySaudi ArabiaCoursesExplore","37,178","8.3","21%","55 : 45"
"201-250","Korea UniversitySouth KoreaCoursesExplore","22,739","15.5","16%","42 : 58"
"201-250","Université Libre de BruxellesBelgiumCoursesVerify Documents","23,712","35.0","32%","54 : 46"
"201-250","Nanjing UniversityChinaCourses","34,784","15.7","9%","42 : 58"
"201-250","National University of Ireland, GalwayIrelandCourses","13,911","26.1","16%","56 : 44"
"201-250","University of NewcastleAustraliaCoursesEnquire","23,838","22.7","18%","56 : 44"
"201-250","North Carolina State UniversityUnited StatesCoursesEnquire","30,187","13.1","12%","45 : 55"
"201-250","University of OtagoNew ZealandCourses","18,567","20.2","20%","57 : 43"
"201-250","University of OuluFinlandCoursesExplore","10,089","23.5","7%","50 : 50"
"201-250","Paris Descartes UniversityFranceCourses","32,978","24.4","15%","63 : 37"
"201-250","Paris Diderot University – Paris 7FranceCourses","27,836","14.8","17%","63 : 37"
"201-250","Politecnico di MilanoItalyCoursesExplore","33,486","25.3","13%","35 : 65"
"201-250","Queensland University of TechnologyAustraliaCoursesExplore","34,398","36.3","17%","54 : 46"
"201-250","Queen’s UniversityCanadaCoursesEnquireExplore","21,015","22.6","11%","58 : 42"
"201-250","Queen’s University BelfastUnited KingdomCoursesExplore","17,348","16.1","32%","55 : 45"
"201-250","RCSI University of Medicine and Health SciencesIrelandCoursesExplore","2,184","18.2","62%","n/a"
"201-250","Shanghai Jiao Tong UniversityChinaCoursesExplore","36,535","12.3","6%","41 : 59"
"201-250","Simon Fraser UniversityCanadaCoursesExplore","26,607","28.3","29%","55 : 45"
"201-250","University of South Florida (Tampa)United StatesCoursesEnquire","32,016","19.0","11%","n/a"
"201-250","St George’s, University of LondonUnited KingdomCoursesEnquire","3,077","14.5","16%","62 : 38"
"201-250","Stony Brook UniversityUnited StatesCoursesEnquire","22,867","10.9","24%","49 : 51"
"201-250","University of StuttgartGermanyCoursesVerify Documents","15,721","30.3","14%","30 : 70"
"201-250","University of Technology SydneyAustraliaCoursesExplore","25,069","44.0","35%","52 : 48"
"201-250","Technical University of DarmstadtGermanyCourses","20,719","51.9","18%","28 : 72"
"201-250","Tel Aviv UniversityIsraelCourses","23,663","24.0","4%","n/a"
"201-250","University of Texas at DallasUnited StatesCoursesExplore","17,825","25.0","25%","44 : 56"
"201-250","Tohoku UniversityJapanCourses","17,349","5.4","9%","26 : 74"
"201-250","University of TrentoItalyCourses","17,118","28.2","9%","52 : 48"
"201-250","University of UtahUnited StatesCoursesEnquire","30,193","14.8","10%","45 : 55"
"201-250","Wake Forest UniversityUnited StatesCoursesEnquireAdmissions Support","7,451","4.5","5%","50 : 50"
"201-250","Western UniversityCanadaCoursesEnquire","28,060","21.6","16%","55 : 45"
"201-250","Zhejiang UniversityChinaCoursesExplore","47,845","15.2","5%","41 : 59"
"201-250","École Normale Supérieure de LyonFranceCourses","2,238","8.4","15%","46 : 54"
"251-300","University of BathUnited KingdomCoursesEnquireAdmissions Support","11,765","16.5","30%","45 : 55"
"251-300","University of BayreuthGermanyCoursesVerify Documents","12,709","37.8","7%","46 : 54"
"251-300","Bielefeld UniversityGermanyCourses","22,279","69.6","8%","57 : 43"
"251-300","University at BuffaloUnited StatesCoursesEnquire","26,418","18.8","21%","46 : 54"
"251-300","Chalmers University of TechnologySwedenCoursesVerify Documents","8,819","11.9","15%","31 : 69"
"251-300","Charles Darwin UniversityAustraliaCoursesEnquire","6,096","21.3","25%","66 : 34"
"251-300","Colorado School of MinesUnited StatesCoursesEnquire","5,437","17.7","11%","27 : 73"
"251-300","Copenhagen Business SchoolDenmarkCoursesVerify Documents","19,154","42.9","21%","48 : 52"
"251-300","Dalhousie UniversityCanadaCoursesEnquire","15,293","14.9","19%","55 : 45"
"251-300","Deakin UniversityAustraliaCoursesEnquire","34,968","31.1","17%","59 : 41"
"251-300","Free University of Bozen-BolzanoItalyCourses","2,813","4.1","16%","67 : 33"
"251-300","University of FribourgSwitzerlandCourses","10,701","46.2","18%","58 : 42"
"251-300","Griffith UniversityAustraliaCoursesExplore","31,031","22.3","20%","56 : 44"
"251-300","University of HohenheimGermanyCoursesVerify Documents","9,524","42.1","13%","57 : 43"
"251-300","James Cook UniversityAustraliaCoursesEnquire","12,004","22.9","13%","63 : 37"
"251-300","Johannes Gutenberg University of MainzGermanyCourses","35,215","31.5","10%","58 : 42"
"251-300","Koç UniversityTurkeyCourses","4,793","14.6","9%","52 : 48"
